{
  "schema_version": "mcp-search-blocks-output.v1",
  "request_id": "mcp_01J",
  "minecraft_version": "26.2",
  "resolved_release_id": "rel_01J",
  "manifest_sha256": "sha256:0000000000000000000000000000000000000000000000000000000000000000",
  "warnings": [],
  "data": {
    "search_id": "S_01J",
    "query": "黄色薄片",
    "hard_filters": [],
    "exclusion_summary": [],
    "candidates": [],
    "contact_sheet": {"image_id": null, "tile_mapping": []},
    "images": [],
    "reranked_by_llm": false
  }
}
